ID,locationName,latitude,longitude,description,Topics,SubjectTags,CompiledTags,Text,NameofAudioFile,NamesofImages,NameofVideo(s),LinktoAudio,LinktoImages,LinktoVideo(s),TranscriptOne,TranscriptTwo
36,Delma Shipyard,24.479773,52.307187,"The Delma shipyard is still active, with boat repairs and fishnet building being the primary activity. The workers are South Asian.",Maritime Economy,"Fishing,Boats/Ships,Shops/Businesses","Maritime Economy,Fishing,Boats/Ships,Shops/Businesses",https://docs.google.com/document/d/1M0empRwPPIn8HslHndo1p2k9G7SWJqWPjnMkJoUxAY4/edit?usp=sharing,,IMG_1066.jpg,"https://www.youtube.com/embed/LC2akgHek0Q,IMG_1068.m4v",,https://drive.google.com/file/d/1VLz31fZcEQnN6BFgJIz4g48yZyYrsuVy/view?usp=sharing,https://drive.google.com/file/d/14B63tH0NtpWGdcPD20ZzdoHv7ny9FUn4/view?usp=sharing,"<div class=""interviewHeader"">Introduction to the Shipyard, <em>Alia Yunis</em>:</div>
<div class=""answerTranscript"">Delma Island’s main source of income after the end of the pearl industry was fishing. It remained a vital part of the economy until the end of the twentieth century, when the majority of the working age population became educated and moved to Abu Dhabi to higher paying jobs. Today, there is still a fishing industry, but the fishermen are from India, although the boats are owned and operated by Emirati residents. It is a smaller industry than it was before. The main way of catching fish is the garghoor, the net cage you can see the fisherman in this video making. These garghoor have caused environmental issues and are strictly limited by the government due to overfishing.  Before the ghargoor, fishing was done with meskar, a cage made of stone. Each fisherman had his own location to place his meskar.  But as three Emirati men in their early 30s  shared with NYUAD students in 2017, trust doesn’t exist anymore, as the majority of the fishermen are not connected directly to families on the island and will take another man’s net haul as his own catch. The young Emirati men told the students that they think fishing is still culturally important to the people of Delma, even though they all work in Abu Dhabi as engineers and accountants. </div>
<div class=""interviewOtherInfo"">Image above is of men crafting fishing nets in a workshop.</div>


",
37,Angry Birds Cafe,24.480228,52.308264,"Near the old port, this is where former fishermen and sometimes their sons gather to play dominos. It's a place where everyone knows everyone.  The cafe only serves tea and shisha. It was opend in 1998 by Mohammed Jassim Tamimi Al Hosani and closed during the COVID pandemic. He also owns another cafe, Methaf al Sayadeen with the same clientele near the Delma Musuem. It opened in 1983. ",,,,,,,,,,,,
38,Olive Trees of Delma ,24.484107,52.302495,"Near the Delma Motel, there is a grove of olive trees. They do not produce olives and are not native to the region. Ghassan Al Ghossein planted the olive trees in 1980, likely because the tree is very symbolic for Palestinians. ",,,,,,,,,,,,
39,Fish Market,24.490257,52.329506,"Located near the new port, the fish market sells local catch, includingg shrimp and grouper. It opened in 2018 and replaced the old fish market at the old port",,,,,,,,,,,,
40,Al Nahyan Palace,24.490523,52.296277,Home of the ruling family when they visit Delma. ,,,,,,,,,,,,
41,Jumaa Al Qubaisi Majlis,24.475014,52.315829,Jumaa is a community leader whose family was one of the first to move to Delma Island.  His father came to the island from Abu Dhabi to be the local imam. ,Lifestyle and Culture,"Food,Family,Majilis","Lifestyle and Culture,Food,Family,Majilis",https://docs.google.com/document/d/10W63jVUAtn4W8oKPlEAFrL44gnQUmaz5bKcRslFB_xk/edit?usp=sharing,,,,,,,"<div class=""interviewHeader"">Interview With Jumaa Al Qubaisi</div><div class=""questionTranscript"">Salama: Wallah, we’re lucky to have you sir.</div>
<div class=""answerTranscript"">Fathi: No, let me tell you. I’ve lived in Dalma and I love its people, I love everyone [here]. And their manners… and I don’t say this out of hypocrisy, I swear, I mean I’m at the last stage of my life, so I’m being sincere. Dalma is one family. I’ve never seen someone here think they’re better than someone else or someone hurt by someone else. Even when I go to your father’s, he has the majlis open, and so anyone who wants to have dinner, this is the excellent social side of things. He gathers people around him at night as one family, and you don’t even necessarily have to be a citizen, you can be an expat, you can be Syrian, Egyptian, khaleeji, Emirati… everyone gathers at his house and we sit together at night. So, there are wonderful traditions in Dalma that maybe the people of Dalma don’t even feel.</div>
<div class=""questionTranscript"">Salama: They’re used to it.</div>
<div class=""answerTranscript"">Fathi: Yes, they’re used to it. And it’s the kindness and the good character and the togetherness of families. I mean, alhamdulillah we don’t have – the divorce rate in Dalma is low, and all the families hold on to one another and the homes are unified, as they say.</div>
",
42,"""Ghost Town"" ",24.505613,52.308873,"This is an area of abandonned villas built in the 1990s for local families, but most have moved away permanently for work and the houses have remained neglected. ",,,,,,,,,,,,
43,New Delma Port,24.48687,52.333309,"This is the new port, that has replaced the Old Delma Port. Ferries arrive here. ",Maritime Economy,"Boats/Ships,Transportation,Clothing,Mosques,Natural Areas,Fishing,Shops/Businesses,Arabic Writing/Calligraphy,English Writing,Water","Maritime Economy,Boats/Ships,Transportation,Clothing,Mosques,Natural Areas,Fishing,Shops/Businesses,Arabic Writing/Calligraphy,English Writing,Water",,,"IMG_7699.jpg,IMG_1080.jpg,IMG_1089.jpg",,,"https://drive.google.com/file/d/19nClK8EvhBlxrfHHCqCZnwBVtxyR4L0D/view, https://drive.google.com/file/d/1JUsrbbPm-RLLJS-rXhLwj3bcgvCQwXXx/view , https://drive.google.com/file/d/1WlVLG3QXtPQeAErYlHN83OoirRrat9KK/view ",,,
44,Female Wedding Hall,24.484285,52.325167,Females gather here for local weddings. Opened in 1983. ,"Lifestyle and Culture,Gender,Archaeology and History","Marriage,Family,Music,Food,Clothing,Marriage,Family,Music,Food,Clothing","Lifestyle and Culture,Gender,Archaeology and History,Marriage,Family,Music,Food,Clothing,Marriage,Family,Music,Food,Clothing",https://docs.google.com/document/d/1UyS3L6ckL9y3k274DA9JyYLoav4n8djcrSnDu3KimzU/edit?usp=sharing,,,,,,,"<div class=""interviewHeader"">Interview with Mrs. Aisha bint Saeed Al Mazrouei (55 y/o)</div>
<div class=""interviewOtherInfoNoMarginBottom"">Date: 1/6/2020</div>
<div class=""interviewOtherInfo"">Interviewer: Salama Al Qubaisi</div>
<div class=""questionTranscript"">Salama: Bint Saeed, tell us about weddings. Do you remember how your wedding was?</div>

<div class=""answerTranscript"">Aisha: Yes, I remember. On the day of my wedding, I was standing at the window and seeing men of Pakistani nationality dancing in the outdoor yard of our house.</div>

<div class=""questionTranscript"">Salama: Who was playing music and singing at that time?</div>

<div class=""answerTranscript"">Aisha: Anyone who can sing can participate and sing or just play the cassette recorder, and there was still no known art of Hubban, as it came to Delma in the eighties.</div>

<div class=""questionTranscript"">Salama: Was the wedding celebration really extended for a week as it is said?</div>

<div class=""answerTranscript"">Aisha: Yes, in the past, people used to do everything and pay attention to the smallest details related to the wedding, and everyone participated in that, and it used to extend for seven days during which the sheep were slaughtered, the rice was prepared, the harees was cooked, and lunch and dinner distributed to everyone.</div>

<div class=""questionTranscript"">Salama: How old were you when you got married?</div>

<div class=""answerTranscript"">Aisha: Between fourteen and fifteen. Most women were married at this age, so even my mother got married at about that age. I remember after I gave birth to my first daughter, it had not been even 40 days after giving birth, my brother was getting married and it was the first day of Ramadan, but I could not attend the wedding because in the past they believed that a woman after giving birth and before completing 40 days would be inauspicious. If she attended any wedding during that period, it might cause the bride to be unable to conceive in the future.</div>

<div class=""questionTranscript"">Salama: Was it allowed to celebrate weddings in Ramadan?</div>

<div class=""answerTranscript"">Aisha: Yes, in the past, everything continues to happen during Ramadan. The families prepare the food and distribute it at Iftar time.</div>

<div class=""questionTranscript"">Salama: What was preparing the bride like in those days?</div>

<div class=""answerTranscript"">Aisha: In the past the groom used to instruct his female family members to supply the bride with everything. I remember that my husband told his cousins that he was getting married and he gave them a sum of money and they bought everything for me-- all kinds of gold (Manthoora, Kawashy, Ma’aded and rings), and they put it in a special bag for gold. In those days, Mr. Rashid bin Fahad would bring from India women’s fabrics called Mizarrai and they bought me about eight pieces of them and also bought me cotton fabrics and they sewed them for me. They bought me everything from clothes, shoes, toiletries and perfumes and put them in big bags for me.</div>

<div class=""questionTranscript"">Salama:  So the groom's family were the ones who previously bought everything for the bride?</div>

<div class=""answerTranscript"">Aisha: Yes, at the time of the marriage contract, the groom puts an amount of money called (Sabaha). Some put in 10,000 or 15,000 dirhams, each according to his ability.  Then his family bought with this amount everything for the bride. In addition to that, they bought fabrics for women and men that were distributed to the families of the neighborhood as a gift from the bride, a gift is placed for each family that includes a piece of cloth for the woman and a piece of cloth for the man, and sometimes a ghutra is added for the man.</div>


<div class=""questionTranscript"">[...]</div>

<div class=""answerTranscript"">Aisha: Yes, in the past, even if the wedding was simple, it was blessed. Everyone would be happy if there was a wedding, and they wouldn’t cook at their homes. When it was time for lunch or dinner, each of them would take his or her plate and go to take from the wedding meal. Everyone participated in cooking and eating as well, and they used to cook for them for three days. But that has changed, as most people have their weddings in Abu Dhabi now.</div>

",
45,Male Wedding Hall,24.48365,52.324601,Males gather here for local weddings. Opened in 1983. ,,,,,,,,,,,,